[
    {
        "index": 0,
        "input_text": "Spodnje Ho\u010de () is a settlement in and the administrative centre of the Municipality of Ho\u010de\u2013Slivnica in northeastern Slovenia.\n",
        "entity_hint": [
            "Municipality of Ho\u010de\u2013Slivnica",
            "Slovenia",
            "Spodnje Ho\u010de",
            "northeastern Slovenia",
            "Ho\u010de\u2013Slivnica"
        ],
        "relation_hint": "1. contains: The subject entity encompasses or includes the entity specified by the object entity.\nFor example, ['Slovenia', 'contains', 'Municipality of Ho\u010de\u2013Slivnica'] can be extracted from \"Spodnje Ho\u010de () is a settlement in and the administrative centre of the Municipality of Ho\u010de\u2013Slivnica in northeastern Slovenia.\n\"\n2. located in the administrative territorial entity: The subject entity is located in the administrative territorial entity specified by the object entity.\nFor example, ['Municipality of Ho\u010de\u2013Slivnica', 'located in the administrative territorial entity', 'northeastern Slovenia'] can be extracted from \"Spodnje Ho\u010de () is a settlement in and the administrative centre of the Municipality of Ho\u010de\u2013Slivnica in northeastern Slovenia.\n\"\n3. contains settlement: The subject entity contains the settlement specified by the object entity.\n4. located in present-day administrative territorial entity: The subject entity is located in the present-day administrative territorial entity specified by the object entity.\n5. contains administrative territorial entity: The subject entity contains the administrative territorial entity specified by the object entity.\n6. country: The subject entity is located in the country specified by the object entity.\nFor example, ['California', 'country', 'United States'] can be extracted from \"Los Trancos Creek (meaning \"barriers\" or \"cattle guards\" from the Spanish \"Las Trancas\") is a creek that flows northerly from Monte Bello Ridge on the northeast slope of the Santa Cruz Mountains to its confluence with San Francisquito Creek at Stanford University in California, United States.\n\"\n7. location: The subject entity is located in the place specified by the object entity.\nFor example, ['Tiverton', 'location', 'Devon'] can be extracted from \"Peter Sainthill (8 July 1593 \u2001E12 August 1648) of Bradninch in Devon, England, was twice elected a Member of Parliament for Tiverton in Devon, in the Short Parliament 1640 and in the Long Parliament in November 1640.\n\"\n8. residence: The subject entity resides in the location specified by the object entity.\nFor example, ['Peter Sainthill', 'residence', 'Bradninch'] can be extracted from \"Peter Sainthill (8 July 1593 \u2001E12 August 1648) of Bradninch in Devon, England, was twice elected a Member of Parliament for Tiverton in Devon, in the Short Parliament 1640 and in the Long Parliament in November 1640.\n\"\n9. capital: The subject entity is the capital city of the country specified by the object entity.\n10. basin country: The subject entity is part of the basin country specified by the object entity.\n11. capital of: The object entity is the capital city of the subject entity.\n",
        "oie": [
            [
                "Spodnje Ho\u010de",
                "located in the administrative territorial entity",
                "Municipality of Ho\u010de\u2013Slivnica"
            ],
            [
                "Municipality of Ho\u010de\u2013Slivnica",
                "contains",
                "Spodnje Ho\u010de"
            ],
            [
                "Municipality of Ho\u010de\u2013Slivnica",
                "located in the administrative territorial entity",
                "northeastern Slovenia"
            ],
            [
                "Slovenia",
                "contains",
                "Municipality of Ho\u010de\u2013Slivnica"
            ]
        ],
        "schema_definition": {
            "located in the administrative territorial entity": "The subject entity is situated within the administrative territorial entity specified by the object entity.",
            "contains": "The subject entity includes or encompasses the object entity within its boundaries or scope."
        },
        "canonicalization_candidates": "[{}, {}, {}, {}]",
        "schema_canonicalizaiton": [
            [
                "Spodnje Ho\u010de",
                "located in the administrative territorial entity",
                "Municipality of Ho\u010de\u2013Slivnica"
            ],
            [
                "Municipality of Ho\u010de\u2013Slivnica",
                "contains",
                "Spodnje Ho\u010de"
            ],
            [
                "Municipality of Ho\u010de\u2013Slivnica",
                "located in the administrative territorial entity",
                "northeastern Slovenia"
            ],
            [
                "Slovenia",
                "contains",
                "Municipality of Ho\u010de\u2013Slivnica"
            ]
        ]
    },
    {
        "index": 1,
        "input_text": "Herbert Blankenhorn (15 December 1904 in M\u00fclhausen\u00a0\u2001E10 August 1991 in Badenweiler) was a German diplomat.\n",
        "entity_hint": [],
        "relation_hint": "1. date of birth: The subject entity was born on the date specified by the object entity.\nFor example, ['Peter Sainthill', 'date of birth', '8 July 1593'] can be extracted from \"Peter Sainthill (8 July 1593 \u2001E12 August 1648) of Bradninch in Devon, England, was twice elected a Member of Parliament for Tiverton in Devon, in the Short Parliament 1640 and in the Long Parliament in November 1640.\n\"\n2. date of death: The subject entity died on the date specified by the object entity.\nFor example, ['Tekla Teresa \u0141ubie\u0144ska', 'date of death', '15 August 1810'] can be extracted from \"Tekla Teresa \u0141ubie\u0144ska (born 6 June 1767 in Warsaw, died 15 August 1810 in Krak\u00f3w) \u2001Ewas a Polish playwright, poet and translator.\n\"\n3. occupation: The subject entity works in the occupation specified by the object entity.\nFor example, ['Tekla Teresa \u0141ubie\u0144ska', 'occupation', 'translator'] can be extracted from \"Tekla Teresa \u0141ubie\u0144ska (born 6 June 1767 in Warsaw, died 15 August 1810 in Krak\u00f3w) \u2001Ewas a Polish playwright, poet and translator.\n\"\n4. place of birth: The subject entity was born in the location specified by the object entity.\nFor example, ['Josef Sch\u00e4ffer', 'place of birth', 'Moravia'] can be extracted from \"Josef Sch\u00e4ffer (born July 2, 1891 in Moravia) was an Austrian track and field athlete who competed in the 1912 Summer Olympics.\n\"\n5. place of death: The subject entity died in the location specified by the object entity.\nFor example, ['Herbert Blankenhorn', 'place of death', 'Badenweiler'] can be extracted from \"Herbert Blankenhorn (15 December 1904 in M\u00fclhausen\u00a0\u2001E10 August 1991 in Badenweiler) was a German diplomat.\n\"\n6. diplomatic relation: The subject entity has a diplomatic relationship with the entity specified by the object entity.\n7. country of origin: The subject entity originates from the country specified by the object entity.\n8. country of citizenship: The subject entity holds the citizenship of the country specified by the object entity.\nFor example, ['Saleem Safi', 'country of citizenship', 'Pakistan'] can be extracted from \"Saleem Safi (Urdu, ) is a Pakistani journalist, columnist, defence analyst and current affairs TV talk show anchorperson.\n\"\n9. historical region: The subject entity is associated with or belongs to the historical region specified by the object entity.\n10. head of state: The subject entity is the head of state of the entity specified by the object entity.\n11. father: The subject entity is the father of the object entity.\n",
        "oie": [
            [
                "Herbert Blankenhorn",
                "date of birth",
                "15 December 1904"
            ],
            [
                "Herbert Blankenhorn",
                "date of death",
                "10 August 1991"
            ],
            [
                "Herbert Blankenhorn",
                "place of birth",
                "M\u00fclhausen"
            ],
            [
                "Herbert Blankenhorn",
                "place of death",
                "Badenweiler"
            ]
        ],
        "schema_definition": {
            "place of death": "The subject entity died in the location specified by the object entity.",
            "date of birth": "The subject entity was born on the date specified by the object entity.",
            "date of death": "The subject entity died on the date specified by the object entity.",
            "place of birth": "The subject entity was born in the location specified by the object entity."
        },
        "canonicalization_candidates": "[{}, {}, {}, {}]",
        "schema_canonicalizaiton": [
            [
                "Herbert Blankenhorn",
                "date of birth",
                "15 December 1904"
            ],
            [
                "Herbert Blankenhorn",
                "date of death",
                "10 August 1991"
            ],
            [
                "Herbert Blankenhorn",
                "place of birth",
                "M\u00fclhausen"
            ],
            [
                "Herbert Blankenhorn",
                "place of death",
                "Badenweiler"
            ]
        ]
    },
    {
        "index": 2,
        "input_text": "Operation Dragon Strike was a NATO counter-insurgent mission in Kandahar province, Afghanistan, against Taliban forces, which started on September 15, 2010.\n",
        "entity_hint": [
            "Afghanistan",
            "Kandahar province",
            "NATO counter-insurgent mission",
            "Operation Dragon Strike",
            "September 15, 2010",
            "Taliban forces",
            "NATO",
            "Kandahar",
            "Taliban"
        ],
        "relation_hint": "1. conflict: The subject entity was involved in the conflict specified by the object entity.\nFor example, ['Taliban forces', 'conflict', 'Operation Dragon Strike'] can be extracted from \"Operation Dragon Strike was a NATO counter-insurgent mission in Kandahar province, Afghanistan, against Taliban forces, which started on September 15, 2010.\n\"\n2. country: The subject entity is located in the country specified by the object entity.\nFor example, ['Devon', 'country', 'England'] can be extracted from \"Peter Sainthill (8 July 1593 \u2001E12 August 1648) of Bradninch in Devon, England, was twice elected a Member of Parliament for Tiverton in Devon, in the Short Parliament 1640 and in the Long Parliament in November 1640.\n\"\n3. location: The subject entity is located in the place specified by the object entity.\nFor example, ['Monte Bello Ridge', 'location', 'Santa Cruz Mountains'] can be extracted from \"Los Trancos Creek (meaning \"barriers\" or \"cattle guards\" from the Spanish \"Las Trancas\") is a creek that flows northerly from Monte Bello Ridge on the northeast slope of the Santa Cruz Mountains to its confluence with San Francisquito Creek at Stanford University in California, United States.\n\"\n4. point in time: The object entity specifies a specific point in time the subject entity took place in.\nFor example, ['Operation Dragon Strike', 'point in time', 'September 15, 2010'] can be extracted from \"Operation Dragon Strike was a NATO counter-insurgent mission in Kandahar province, Afghanistan, against Taliban forces, which started on September 15, 2010.\n\"\n5. subclass of: The subject entity is a subclass or specific type of the object entity.\nFor example, ['Operation Dragon Strike', 'subclass of', 'NATO counter-insurgent mission'] can be extracted from \"Operation Dragon Strike was a NATO counter-insurgent mission in Kandahar province, Afghanistan, against Taliban forces, which started on September 15, 2010.\n\"\n6. military branch: The subject entity belongs to the military branch specified by the object entity.\n7. target: The subject entity is the target of the action or event specified by the object entity.\n8. start time: The subject entity began at the time specified by the object entity.\nFor example, ['Long Parliament', 'start time', 'November 1640'] can be extracted from \"Peter Sainthill (8 July 1593 \u2001E12 August 1648) of Bradninch in Devon, England, was twice elected a Member of Parliament for Tiverton in Devon, in the Short Parliament 1640 and in the Long Parliament in November 1640.\n\"\n9. country of origin: The subject entity originates from the country specified by the object entity.\n10. basin country: The subject entity is part of the basin country specified by the object entity.\n11. relative: The subject entity is related to the entity specified by the object entity.\n12. subsidiary: The subject entity is a subsidiary or part of the entity specified by the object entity.\n",
        "oie": [
            [
                "Operation Dragon Strike",
                "conflict",
                "Taliban forces"
            ],
            [
                "Operation Dragon Strike",
                "location",
                "Kandahar province"
            ],
            [
                "Operation Dragon Strike",
                "point in time",
                "September 15, 2010"
            ]
        ],
        "schema_definition": {
            "conflict": "The subject entity was involved in or is associated with the conflict or opposition with the object entity.",
            "point in time": "The subject entity occurred or took place at the specific point in time specified by the object entity.",
            "location": "The subject entity is situated in or takes place at the geographical area specified by the object entity."
        },
        "canonicalization_candidates": "[{}, {}, {}]",
        "schema_canonicalizaiton": [
            [
                "Operation Dragon Strike",
                "conflict",
                "Taliban forces"
            ],
            [
                "Operation Dragon Strike",
                "location",
                "Kandahar province"
            ],
            [
                "Operation Dragon Strike",
                "point in time",
                "September 15, 2010"
            ]
        ]
    },
    {
        "index": 3,
        "input_text": "Saleem Safi (Urdu, ) is a Pakistani journalist, columnist, defence analyst and current affairs TV talk show anchorperson.\n",
        "entity_hint": [
            "Pakistan",
            "Saleem Safi",
            "TV talk show anchorperson",
            "Urdu",
            "columnist",
            "defence analyst",
            "journalist"
        ],
        "relation_hint": "1. country of citizenship: The subject entity holds the citizenship of the country specified by the object entity.\nFor example, ['Saleem Safi', 'country of citizenship', 'Pakistan'] can be extracted from \"Saleem Safi (Urdu, ) is a Pakistani journalist, columnist, defence analyst and current affairs TV talk show anchorperson.\n\"\n2. language used: The subject entity uses the language specified by the object entity.\nFor example, ['Saleem Safi', 'language used', 'Urdu'] can be extracted from \"Saleem Safi (Urdu, ) is a Pakistani journalist, columnist, defence analyst and current affairs TV talk show anchorperson.\n\"\n3. occupation: The subject entity works in the occupation specified by the object entity.\nFor example, ['Tekla Teresa \u0141ubie\u0144ska', 'occupation', 'poet'] can be extracted from \"Tekla Teresa \u0141ubie\u0144ska (born 6 June 1767 in Warsaw, died 15 August 1810 in Krak\u00f3w) \u2001Ewas a Polish playwright, poet and translator.\n\"\n4. presenter: The subject entity was presented or hosted by the person specified by the object entity.\n5. relative: The subject entity is related to the entity specified by the object entity.\n6. field of this occupation: The subject entity works in the field specified by the object entity.\n7. is a list of: The subject entity is a member of the list or category specified by the object entity.\n8. sibling: The subject entity is a sibling of the entity specified by the object entity.\n9. subclass of: The subject entity is a subclass or specific type of the object entity.\nFor example, ['Monopoly Star Wars', 'subclass of', 'video game'] can be extracted from \"Monopoly Star Wars is the 1997 Monopoly franchise Star Wars video game based on the board game and set in the Star Wars fictional universe.\n\"\n10. employer: The subject entity is employed by the entity specified by the object entity.\n11. member of: The subject entity is a member of the group or organization specified by the object entity.\n12. speaker: The subject entity delivered a speech or address as the person specified by the object entity.\n",
        "oie": [
            [
                "Saleem Safi",
                "country of citizenship",
                "Pakistan"
            ],
            [
                "Saleem Safi",
                "language used",
                "Urdu"
            ],
            [
                "Saleem Safi",
                "occupation",
                "journalist"
            ],
            [
                "Saleem Safi",
                "occupation",
                "columnist"
            ],
            [
                "Saleem Safi",
                "occupation",
                "defence analyst"
            ],
            [
                "Saleem Safi",
                "occupation",
                "TV talk show anchorperson"
            ]
        ],
        "schema_definition": {
            "country of citizenship": "The subject entity holds citizenship in the country specified by the object entity.",
            "language used": "The subject entity uses the language specified by the object entity.",
            "occupation": "The subject entity is engaged in the profession or role specified by the object entity."
        },
        "canonicalization_candidates": "[{}, {}, {}, {}, {}, {}]",
        "schema_canonicalizaiton": [
            [
                "Saleem Safi",
                "country of citizenship",
                "Pakistan"
            ],
            [
                "Saleem Safi",
                "language used",
                "Urdu"
            ],
            [
                "Saleem Safi",
                "occupation",
                "journalist"
            ],
            [
                "Saleem Safi",
                "occupation",
                "columnist"
            ],
            [
                "Saleem Safi",
                "occupation",
                "defence analyst"
            ],
            [
                "Saleem Safi",
                "occupation",
                "TV talk show anchorperson"
            ]
        ]
    },
    {
        "index": 4,
        "input_text": "Los Trancos Creek (meaning \"barriers\" or \"cattle guards\" from the Spanish \"Las Trancas\") is a creek that flows northerly from Monte Bello Ridge on the northeast slope of the Santa Cruz Mountains to its confluence with San Francisquito Creek at Stanford University in California, United States.\n",
        "entity_hint": [
            "California",
            "Los Trancos Creek",
            "Monte Bello Ridge",
            "San Francisquito Creek",
            "Santa Cruz Mountains",
            "Stanford University",
            "United States",
            "northeast slope"
        ],
        "relation_hint": "1. country: The subject entity is located in the country specified by the object entity.\nFor example, ['California', 'country', 'United States'] can be extracted from \"Los Trancos Creek (meaning \"barriers\" or \"cattle guards\" from the Spanish \"Las Trancas\") is a creek that flows northerly from Monte Bello Ridge on the northeast slope of the Santa Cruz Mountains to its confluence with San Francisquito Creek at Stanford University in California, United States.\n\"\n2. location: The subject entity is located in the place specified by the object entity.\nFor example, ['Stanford University', 'location', 'California'] can be extracted from \"Los Trancos Creek (meaning \"barriers\" or \"cattle guards\" from the Spanish \"Las Trancas\") is a creek that flows northerly from Monte Bello Ridge on the northeast slope of the Santa Cruz Mountains to its confluence with San Francisquito Creek at Stanford University in California, United States.\n\"\n3. location of formation: The subject entity was formed or established in the location specified by the object entity.\nFor example, ['Los Trancos Creek', 'location of formation', 'Monte Bello Ridge'] can be extracted from \"Los Trancos Creek (meaning \"barriers\" or \"cattle guards\" from the Spanish \"Las Trancas\") is a creek that flows northerly from Monte Bello Ridge on the northeast slope of the Santa Cruz Mountains to its confluence with San Francisquito Creek at Stanford University in California, United States.\n\"\n4. mouth of the watercourse: The subject entity is the point where the watercourse specified by the object entity flows into.\nFor example, ['Los Trancos Creek', 'mouth of the watercourse', 'San Francisquito Creek'] can be extracted from \"Los Trancos Creek (meaning \"barriers\" or \"cattle guards\" from the Spanish \"Las Trancas\") is a creek that flows northerly from Monte Bello Ridge on the northeast slope of the Santa Cruz Mountains to its confluence with San Francisquito Creek at Stanford University in California, United States.\n\"\n5. located on terrain feature: The subject entity is located on the terrain feature specified by the object entity.\n6. mountain range: The subject entity belongs to the mountain range specified by the object entity.\n7. tributary: The subject entity is a tributary that flows into the watercourse specified by the object entity.\n8. located in or next to body of water: The subject entity is situated in or near the body of water specified by the object entity.\n9. located in the administrative territorial entity: The subject entity is located in the administrative territorial entity specified by the object entity.\nFor example, ['Spodnje Ho\u010de', 'located in the administrative territorial entity', 'Municipality of Ho\u010de\u2013Slivnica'] can be extracted from \"Spodnje Ho\u010de () is a settlement in and the administrative centre of the Municipality of Ho\u010de\u2013Slivnica in northeastern Slovenia.\n\"\n10. located in present-day administrative territorial entity: The subject entity is located in the present-day administrative territorial entity specified by the object entity.\n11. lakes on river: The subject entity is a collection of lakes that are located on the river specified by the object entity.\n",
        "oie": [
            [
                "Los Trancos Creek",
                "mouth of the watercourse",
                "San Francisquito Creek"
            ],
            [
                "Los Trancos Creek",
                "location",
                "California"
            ],
            [
                "Los Trancos Creek",
                "location of formation",
                "Monte Bello Ridge"
            ],
            [
                "Monte Bello Ridge",
                "located on terrain feature",
                "northeast slope"
            ],
            [
                "Monte Bello Ridge",
                "mountain range",
                "Santa Cruz Mountains"
            ],
            [
                "Santa Cruz Mountains",
                "located in the administrative territorial entity",
                "California"
            ],
            [
                "San Francisquito Creek",
                "located in the administrative territorial entity",
                "California"
            ],
            [
                "Stanford University",
                "located in the administrative territorial entity",
                "California"
            ],
            [
                "Los Trancos Creek",
                "country",
                "United States"
            ],
            [
                "San Francisquito Creek",
                "country",
                "United States"
            ],
            [
                "Stanford University",
                "country",
                "United States"
            ],
            [
                "California",
                "country",
                "United States"
            ]
        ],
        "schema_definition": {
            "mountain range": "The subject entity is part of the mountain range specified by the object entity.",
            "location": "The subject entity is situated in the place specified by the object entity.",
            "mouth of the watercourse": "The subject entity is the endpoint where the watercourse flows into the specified body of water or location.",
            "located in the administrative territorial entity": "The subject entity is situated within the administrative territorial entity specified by the object entity.",
            "country": "The subject entity is located within the country specified by the object entity.",
            "located on terrain feature": "The subject entity is situated on the terrain feature specified by the object entity.",
            "location of formation": "The subject entity originates or is formed at the location specified by the object entity."
        },
        "canonicalization_candidates": "[{}, {}, {}, {}, {}, {}, {}, {}, {}, {}, {}, {}]",
        "schema_canonicalizaiton": [
            [
                "Los Trancos Creek",
                "mouth of the watercourse",
                "San Francisquito Creek"
            ],
            [
                "Los Trancos Creek",
                "location",
                "California"
            ],
            [
                "Los Trancos Creek",
                "location of formation",
                "Monte Bello Ridge"
            ],
            [
                "Monte Bello Ridge",
                "located on terrain feature",
                "northeast slope"
            ],
            [
                "Monte Bello Ridge",
                "mountain range",
                "Santa Cruz Mountains"
            ],
            [
                "Santa Cruz Mountains",
                "located in the administrative territorial entity",
                "California"
            ],
            [
                "San Francisquito Creek",
                "located in the administrative territorial entity",
                "California"
            ],
            [
                "Stanford University",
                "located in the administrative territorial entity",
                "California"
            ],
            [
                "Los Trancos Creek",
                "country",
                "United States"
            ],
            [
                "San Francisquito Creek",
                "country",
                "United States"
            ],
            [
                "Stanford University",
                "country",
                "United States"
            ],
            [
                "California",
                "country",
                "United States"
            ]
        ]
    },
    {
        "index": 5,
        "input_text": "Peter Sainthill (8 July 1593 \u2001E12 August 1648) of Bradninch in Devon, England, was twice elected a Member of Parliament for Tiverton in Devon, in the Short Parliament 1640 and in the Long Parliament in November 1640.\n",
        "entity_hint": [
            "12 August 1648",
            "8 July 1593",
            "Bradninch",
            "Devon",
            "England",
            "Long Parliament",
            "Member of Parliament",
            "November 1640",
            "Peter Sainthill",
            "Short Parliament 1640",
            "Tiverton"
        ],
        "relation_hint": "1. candidacy in election: The subject entity ran as a candidate in the election specified by the object entity.\nFor example, ['Peter Sainthill', 'candidacy in election', 'Long Parliament'] can be extracted from \"Peter Sainthill (8 July 1593 \u2001E12 August 1648) of Bradninch in Devon, England, was twice elected a Member of Parliament for Tiverton in Devon, in the Short Parliament 1640 and in the Long Parliament in November 1640.\n\"\n2. country: The subject entity is located in the country specified by the object entity.\nFor example, ['California', 'country', 'United States'] can be extracted from \"Los Trancos Creek (meaning \"barriers\" or \"cattle guards\" from the Spanish \"Las Trancas\") is a creek that flows northerly from Monte Bello Ridge on the northeast slope of the Santa Cruz Mountains to its confluence with San Francisquito Creek at Stanford University in California, United States.\n\"\n3. date of birth: The subject entity was born on the date specified by the object entity.\nFor example, ['Peter Sainthill', 'date of birth', '8 July 1593'] can be extracted from \"Peter Sainthill (8 July 1593 \u2001E12 August 1648) of Bradninch in Devon, England, was twice elected a Member of Parliament for Tiverton in Devon, in the Short Parliament 1640 and in the Long Parliament in November 1640.\n\"\n4. date of death: The subject entity died on the date specified by the object entity.\nFor example, ['Tekla Teresa \u0141ubie\u0144ska', 'date of death', '15 August 1810'] can be extracted from \"Tekla Teresa \u0141ubie\u0144ska (born 6 June 1767 in Warsaw, died 15 August 1810 in Krak\u00f3w) \u2001Ewas a Polish playwright, poet and translator.\n\"\n5. located in the administrative territorial entity: The subject entity is located in the administrative territorial entity specified by the object entity.\nFor example, ['Municipality of Ho\u010de\u2013Slivnica', 'located in the administrative territorial entity', 'northeastern Slovenia'] can be extracted from \"Spodnje Ho\u010de () is a settlement in and the administrative centre of the Municipality of Ho\u010de\u2013Slivnica in northeastern Slovenia.\n\"\n6. location: The subject entity is located in the place specified by the object entity.\nFor example, ['Monte Bello Ridge', 'location', 'Santa Cruz Mountains'] can be extracted from \"Los Trancos Creek (meaning \"barriers\" or \"cattle guards\" from the Spanish \"Las Trancas\") is a creek that flows northerly from Monte Bello Ridge on the northeast slope of the Santa Cruz Mountains to its confluence with San Francisquito Creek at Stanford University in California, United States.\n\"\n7. position held: The subject entity held the position specified by the object entity.\nFor example, ['Peter Sainthill', 'position held', 'Member of Parliament'] can be extracted from \"Peter Sainthill (8 July 1593 \u2001E12 August 1648) of Bradninch in Devon, England, was twice elected a Member of Parliament for Tiverton in Devon, in the Short Parliament 1640 and in the Long Parliament in November 1640.\n\"\n8. residence: The subject entity resides in the location specified by the object entity.\nFor example, ['Peter Sainthill', 'residence', 'Bradninch'] can be extracted from \"Peter Sainthill (8 July 1593 \u2001E12 August 1648) of Bradninch in Devon, England, was twice elected a Member of Parliament for Tiverton in Devon, in the Short Parliament 1640 and in the Long Parliament in November 1640.\n\"\n9. start time: The subject entity began at the time specified by the object entity.\nFor example, ['Long Parliament', 'start time', 'November 1640'] can be extracted from \"Peter Sainthill (8 July 1593 \u2001E12 August 1648) of Bradninch in Devon, England, was twice elected a Member of Parliament for Tiverton in Devon, in the Short Parliament 1640 and in the Long Parliament in November 1640.\n\"\n10. member of political party: The subject entity is a member of the political party specified by the object entity.\n11. sibling: The subject entity is a sibling of the entity specified by the object entity.\n12. family: The subject entity belongs to the family specified by the object entity.\n13. head of government: The subject entity is the leader or head of government of the entity specified by the object entity.\n14. historical region: The subject entity is associated with or belongs to the historical region specified by the object entity.\n15. officeholder: The subject entity is the officeholder of the position specified by the object entity.\n16. legislative body: The subject entity is the legislative body of the jurisdiction specified by the object entity.\n17. head of state: The subject entity is the head of state of the entity specified by the object entity.\n18. relative: The subject entity is related to the entity specified by the object entity.\n19. is a list of: The subject entity is a member of the list or category specified by the object entity.\n",
        "oie": [
            [
                "Peter Sainthill",
                "date of birth",
                "8 July 1593"
            ],
            [
                "Peter Sainthill",
                "date of death",
                "12 August 1648"
            ],
            [
                "Peter Sainthill",
                "residence",
                "Bradninch"
            ],
            [
                "Peter Sainthill",
                "position held",
                "Member of Parliament"
            ],
            [
                "Peter Sainthill",
                "candidacy in election",
                "Short Parliament 1640"
            ],
            [
                "Peter Sainthill",
                "candidacy in election",
                "Long Parliament"
            ],
            [
                "Peter Sainthill",
                "candidacy in election",
                "November 1640"
            ],
            [
                "Tiverton",
                "candidacy in election",
                "Peter Sainthill"
            ],
            [
                "Bradninch",
                "located in the administrative territorial entity",
                "Devon"
            ],
            [
                "Devon",
                "located in the administrative territorial entity",
                "England"
            ]
        ],
        "schema_definition": {
            "date of death": "The subject entity died on the date specified by the object entity.",
            "position held": "The subject entity occupied or held the position specified by the object entity.",
            "date of birth": "The subject entity was born on the date specified by the object entity.",
            "located in the administrative territorial entity": "The subject entity is situated within or is part of the administrative territorial entity specified by the object entity.",
            "candidacy in election": "The subject entity was a candidate or ran for office in the election specified by the object entity.",
            "residence": "The subject entity's place of residence is the location specified by the object entity."
        },
        "canonicalization_candidates": "[{}, {}, {}, {}, {}, {}, {}, {}, {}, {}]",
        "schema_canonicalizaiton": [
            [
                "Peter Sainthill",
                "date of birth",
                "8 July 1593"
            ],
            [
                "Peter Sainthill",
                "date of death",
                "12 August 1648"
            ],
            [
                "Peter Sainthill",
                "residence",
                "Bradninch"
            ],
            [
                "Peter Sainthill",
                "position held",
                "Member of Parliament"
            ],
            [
                "Peter Sainthill",
                "candidacy in election",
                "Short Parliament 1640"
            ],
            [
                "Peter Sainthill",
                "candidacy in election",
                "Long Parliament"
            ],
            [
                "Peter Sainthill",
                "candidacy in election",
                "November 1640"
            ],
            [
                "Tiverton",
                "candidacy in election",
                "Peter Sainthill"
            ],
            [
                "Bradninch",
                "located in the administrative territorial entity",
                "Devon"
            ],
            [
                "Devon",
                "located in the administrative territorial entity",
                "England"
            ]
        ]
    },
    {
        "index": 6,
        "input_text": "Romany Love is a 1931 British musical film directed by Fred Paul and starring Esmond Knight, Florence McHugh and Roy Travers.\n",
        "entity_hint": [
            "1931",
            "Britain",
            "Esmond Knight",
            "Florence McHugh",
            "Fred Paul",
            "Romany Love",
            "Roy Travers",
            "musical film",
            "British"
        ],
        "relation_hint": "1. cast member: The subject entity includes the person specified by the object entity as a member of its cast.\nFor example, ['Florence McHugh', 'cast member', 'Romany Love'] can be extracted from \"Romany Love is a 1931 British musical film directed by Fred Paul and starring Esmond Knight, Florence McHugh and Roy Travers.\n\"\n2. country: The subject entity is located in the country specified by the object entity.\nFor example, ['Romany Love', 'country', 'Britain'] can be extracted from \"Romany Love is a 1931 British musical film directed by Fred Paul and starring Esmond Knight, Florence McHugh and Roy Travers.\n\"\n3. director: The subject entity was directed by the person or entity specified by the object entity.\nFor example, ['Romany Love', 'director', 'Fred Paul'] can be extracted from \"Romany Love is a 1931 British musical film directed by Fred Paul and starring Esmond Knight, Florence McHugh and Roy Travers.\n\"\n4. genre: The subject entity belongs to the genre specified by the object entity.\nFor example, ['Romany Love', 'genre', 'musical film'] can be extracted from \"Romany Love is a 1931 British musical film directed by Fred Paul and starring Esmond Knight, Florence McHugh and Roy Travers.\n\"\n5. publication date: The subject entity was published or released on the date specified by the object entity.\nFor example, ['Romany Love', 'publication date', '1931'] can be extracted from \"Romany Love is a 1931 British musical film directed by Fred Paul and starring Esmond Knight, Florence McHugh and Roy Travers.\n\"\n6. composer: The subject entity's music was composed by the person specified by the object entity.\n7. voice type: The subject entity has the voice type specified by the object entity.\n8. present in work: The subject entity is present or featured in the work specified by the object entity.\n9. performer: The subject entity was performed or created by the person or entity specified by the object entity.\n10. relative: The subject entity is related to the entity specified by the object entity.\n11. depicts: The subject entity portrays or represents the entity specified by the object entity.\n12. characters: The object entity includes the subject entity as one of its characters.\n",
        "oie": [
            [
                "Romany Love",
                "country",
                "Britain"
            ],
            [
                "Romany Love",
                "director",
                "Fred Paul"
            ],
            [
                "Esmond Knight",
                "cast member",
                "Romany Love"
            ],
            [
                "Florence McHugh",
                "cast member",
                "Romany Love"
            ],
            [
                "Roy Travers",
                "cast member",
                "Romany Love"
            ],
            [
                "Romany Love",
                "genre",
                "musical film"
            ],
            [
                "Romany Love",
                "publication date",
                "1931"
            ]
        ],
        "schema_definition": {
            "publication date": "The subject entity was published or released on the date specified by the object entity.",
            "cast member": "The subject entity is a person who is part of the cast of the subject film.",
            "director": "The subject entity is a person who directed the subject film.",
            "country": "The subject entity is associated with the country specified by the object entity.",
            "genre": "The subject entity belongs to the genre specified by the object entity."
        },
        "canonicalization_candidates": "[{}, {}, {}, {}, {}, {}, {}]",
        "schema_canonicalizaiton": [
            [
                "Romany Love",
                "country",
                "Britain"
            ],
            [
                "Romany Love",
                "director",
                "Fred Paul"
            ],
            [
                "Esmond Knight",
                "cast member",
                "Romany Love"
            ],
            [
                "Florence McHugh",
                "cast member",
                "Romany Love"
            ],
            [
                "Roy Travers",
                "cast member",
                "Romany Love"
            ],
            [
                "Romany Love",
                "genre",
                "musical film"
            ],
            [
                "Romany Love",
                "publication date",
                "1931"
            ]
        ]
    },
    {
        "index": 7,
        "input_text": "Monopoly Star Wars is the 1997 Monopoly franchise Star Wars video game based on the board game and set in the Star Wars fictional universe.\n",
        "entity_hint": [
            "1997",
            "Monopoly Star Wars",
            "Star Wars",
            "Star Wars fictional universe",
            "board game",
            "video game",
            "Monopoly"
        ],
        "relation_hint": "1. based on: The subject entity is based on or inspired by the entity specified by the object entity.\nFor example, ['Monopoly Star Wars', 'based on', 'board game'] can be extracted from \"Monopoly Star Wars is the 1997 Monopoly franchise Star Wars video game based on the board game and set in the Star Wars fictional universe.\n\"\n2. narrative location: The subject entity's storyline or setting is based in the location specified by the object entity.\nFor example, ['Monopoly Star Wars', 'narrative location', 'Star Wars fictional universe'] can be extracted from \"Monopoly Star Wars is the 1997 Monopoly franchise Star Wars video game based on the board game and set in the Star Wars fictional universe.\n\"\n3. part of: The subject entity is a part of or belongs to the object entity.\nFor example, ['Star Wars fictional universe', 'part of', 'Star Wars'] can be extracted from \"Monopoly Star Wars is the 1997 Monopoly franchise Star Wars video game based on the board game and set in the Star Wars fictional universe.\n\"\n4. publication date: The subject entity was published or released on the date specified by the object entity.\nFor example, ['Monopoly Star Wars', 'publication date', '1997'] can be extracted from \"Monopoly Star Wars is the 1997 Monopoly franchise Star Wars video game based on the board game and set in the Star Wars fictional universe.\n\"\n5. subclass of: The subject entity is a subclass or specific type of the object entity.\nFor example, ['Monopoly Star Wars', 'subclass of', 'video game'] can be extracted from \"Monopoly Star Wars is the 1997 Monopoly franchise Star Wars video game based on the board game and set in the Star Wars fictional universe.\n\"\n6. media franchise: The subject entity is a part of the media franchise specified by the object entity.\n7. game mechanics: The subject entity features the game mechanics specified by the object entity.\n8. part of the series: The subject entity is a part of the series specified by the object entity.\n9. game mode: The subject entity features the game mode specified by the object entity.\n10. characters: The object entity includes the subject entity as one of its characters.\n11. owned by: The subject entity is owned by the entity specified by the object entity.\n12. production company: The subject entity was produced or created by the company specified by the object entity.\n13. present in work: The subject entity is present or featured in the work specified by the object entity.\n14. relative: The subject entity is related to the entity specified by the object entity.\n",
        "oie": [
            [
                "Monopoly Star Wars",
                "based on",
                "board game"
            ],
            [
                "Monopoly Star Wars",
                "narrative location",
                "Star Wars fictional universe"
            ],
            [
                "Star Wars fictional universe",
                "part of",
                "Star Wars"
            ],
            [
                "Monopoly Star Wars",
                "publication date",
                "1997"
            ],
            [
                "Monopoly Star Wars",
                "subclass of",
                "video game"
            ]
        ],
        "schema_definition": {
            "part of": "The subject entity is a component or member of the larger entity specified by the object entity.",
            "publication date": "The subject entity was published or released on the date specified by the object entity.",
            "subclass of": "The subject entity is a specific type or category within the broader class specified by the object entity.",
            "based on": "The subject entity is derived from, adapted from, or inspired by the entity specified by the object entity.",
            "narrative location": "The story or content of the subject entity is set in or takes place within the location specified by the object entity."
        },
        "canonicalization_candidates": "[{}, {}, {}, {}, {}]",
        "schema_canonicalizaiton": [
            [
                "Monopoly Star Wars",
                "based on",
                "board game"
            ],
            [
                "Monopoly Star Wars",
                "narrative location",
                "Star Wars fictional universe"
            ],
            [
                "Star Wars fictional universe",
                "part of",
                "Star Wars"
            ],
            [
                "Monopoly Star Wars",
                "publication date",
                "1997"
            ],
            [
                "Monopoly Star Wars",
                "subclass of",
                "video game"
            ]
        ]
    },
    {
        "index": 8,
        "input_text": "Josef Sch\u00e4ffer (born July 2, 1891 in Moravia) was an Austrian track and field athlete who competed in the 1912 Summer Olympics.\n",
        "entity_hint": [
            "1912 Summer Olympics",
            "Austrian",
            "Josef Sch\u00e4ffer",
            "July 2, 1891",
            "Moravia",
            "track and field athlete",
            "Austria"
        ],
        "relation_hint": "1. country of citizenship: The subject entity holds the citizenship of the country specified by the object entity.\nFor example, ['Josef Sch\u00e4ffer', 'country of citizenship', 'Austrian'] can be extracted from \"Josef Sch\u00e4ffer (born July 2, 1891 in Moravia) was an Austrian track and field athlete who competed in the 1912 Summer Olympics.\n\"\n2. date of birth: The subject entity was born on the date specified by the object entity.\nFor example, ['Tekla Teresa \u0141ubie\u0144ska', 'date of birth', '6 June 1767'] can be extracted from \"Tekla Teresa \u0141ubie\u0144ska (born 6 June 1767 in Warsaw, died 15 August 1810 in Krak\u00f3w) \u2001Ewas a Polish playwright, poet and translator.\n\"\n3. occupation: The subject entity works in the occupation specified by the object entity.\nFor example, ['Saleem Safi', 'occupation', 'journalist'] can be extracted from \"Saleem Safi (Urdu, ) is a Pakistani journalist, columnist, defence analyst and current affairs TV talk show anchorperson.\n\"\n4. participant in: The subject entity took part in the event specified by the object entity.\nFor example, ['Josef Sch\u00e4ffer', 'participant in', '1912 Summer Olympics'] can be extracted from \"Josef Sch\u00e4ffer (born July 2, 1891 in Moravia) was an Austrian track and field athlete who competed in the 1912 Summer Olympics.\n\"\n5. place of birth: The subject entity was born in the location specified by the object entity.\nFor example, ['Tekla Teresa \u0141ubie\u0144ska', 'place of birth', 'Warsaw'] can be extracted from \"Tekla Teresa \u0141ubie\u0144ska (born 6 June 1767 in Warsaw, died 15 August 1810 in Krak\u00f3w) \u2001Ewas a Polish playwright, poet and translator.\n\"\n6. sports discipline competed in: The subject entity competes in the sports discipline specified by the object entity.\n7. sport: The subject entity is associated with the sport specified by the object entity.\n8. country for sport: The subject entity represents the country specified by the object entity in the sport mentioned.\n9. country of origin: The subject entity originates from the country specified by the object entity.\n10. member of sports team: The subject entity is a member of the sports team specified by the object entity.\n11. father: The subject entity is the father of the object entity.\n12. competition class: The subject entity competes in the competition class specified by the object entity.\n",
        "oie": [
            [
                "Josef Sch\u00e4ffer",
                "date of birth",
                "July 2, 1891"
            ],
            [
                "Josef Sch\u00e4ffer",
                "place of birth",
                "Moravia"
            ],
            [
                "Josef Sch\u00e4ffer",
                "country of citizenship",
                "Austrian"
            ],
            [
                "Josef Sch\u00e4ffer",
                "participant in",
                "1912 Summer Olympics"
            ],
            [
                "Josef Sch\u00e4ffer",
                "occupation",
                "track and field athlete"
            ]
        ],
        "schema_definition": {
            "place of birth": "The subject entity was born in the location specified by the object entity.",
            "country of citizenship": "The subject entity holds citizenship or nationality in the country specified by the object entity.",
            "participant in": "The subject entity took part in the event or activity specified by the object entity.",
            "date of birth": "The subject entity was born on the date specified by the object entity.",
            "occupation": "The subject entity is engaged in the profession or role specified by the object entity."
        },
        "canonicalization_candidates": "[{}, {}, {}, {}, {}]",
        "schema_canonicalizaiton": [
            [
                "Josef Sch\u00e4ffer",
                "date of birth",
                "July 2, 1891"
            ],
            [
                "Josef Sch\u00e4ffer",
                "place of birth",
                "Moravia"
            ],
            [
                "Josef Sch\u00e4ffer",
                "country of citizenship",
                "Austrian"
            ],
            [
                "Josef Sch\u00e4ffer",
                "participant in",
                "1912 Summer Olympics"
            ],
            [
                "Josef Sch\u00e4ffer",
                "occupation",
                "track and field athlete"
            ]
        ]
    },
    {
        "index": 9,
        "input_text": "Tekla Teresa \u0141ubie\u0144ska (born 6 June 1767 in Warsaw, died 15 August 1810 in Krak\u00f3w) \u2001Ewas a Polish playwright, poet and translator.\n",
        "entity_hint": [
            "15 August 1810",
            "6 June 1767",
            "Krak\u00f3w",
            "Tekla Teresa \u0141ubie\u0144ska",
            "Warsaw",
            "playwright",
            "poet",
            "translator",
            "Polish"
        ],
        "relation_hint": "1. date of birth: The subject entity was born on the date specified by the object entity.\nFor example, ['Josef Sch\u00e4ffer', 'date of birth', 'July 2, 1891'] can be extracted from \"Josef Sch\u00e4ffer (born July 2, 1891 in Moravia) was an Austrian track and field athlete who competed in the 1912 Summer Olympics.\n\"\n2. date of death: The subject entity died on the date specified by the object entity.\nFor example, ['Herbert Blankenhorn', 'date of death', '10 August 1991'] can be extracted from \"Herbert Blankenhorn (15 December 1904 in M\u00fclhausen\u00a0\u2001E10 August 1991 in Badenweiler) was a German diplomat.\n\"\n3. occupation: The subject entity works in the occupation specified by the object entity.\nFor example, ['Saleem Safi', 'occupation', 'TV talk show anchorperson'] can be extracted from \"Saleem Safi (Urdu, ) is a Pakistani journalist, columnist, defence analyst and current affairs TV talk show anchorperson.\n\"\n4. place of birth: The subject entity was born in the location specified by the object entity.\nFor example, ['Herbert Blankenhorn', 'place of birth', 'M\u00fclhausen'] can be extracted from \"Herbert Blankenhorn (15 December 1904 in M\u00fclhausen\u00a0\u2001E10 August 1991 in Badenweiler) was a German diplomat.\n\"\n5. place of death: The subject entity died in the location specified by the object entity.\nFor example, ['Herbert Blankenhorn', 'place of death', 'Badenweiler'] can be extracted from \"Herbert Blankenhorn (15 December 1904 in M\u00fclhausen\u00a0\u2001E10 August 1991 in Badenweiler) was a German diplomat.\n\"\n6. librettist: The subject entity's book or libretto was written by the person or entity specified by the object entity.\n7. screenwriter: The subject entity was written by the person or entity specified by the object entity.\n8. author: The subject entity was authored or created by the person specified by the object entity.\n9. lyrics by: The subject entity's lyrics were written by the person specified by the object entity.\n10. writing language: The subject entity was written in the language specified by the object entity.\n11. historical region: The subject entity is associated with or belongs to the historical region specified by the object entity.\n",
        "oie": [
            [
                "Tekla Teresa \u0141ubie\u0144ska",
                "date of birth",
                "6 June 1767"
            ],
            [
                "Tekla Teresa \u0141ubie\u0144ska",
                "place of birth",
                "Warsaw"
            ],
            [
                "Tekla Teresa \u0141ubie\u0144ska",
                "date of death",
                "15 August 1810"
            ],
            [
                "Tekla Teresa \u0141ubie\u0144ska",
                "place of death",
                "Krak\u00f3w"
            ],
            [
                "Tekla Teresa \u0141ubie\u0144ska",
                "occupation",
                "playwright"
            ],
            [
                "Tekla Teresa \u0141ubie\u0144ska",
                "occupation",
                "poet"
            ],
            [
                "Tekla Teresa \u0141ubie\u0144ska",
                "occupation",
                "translator"
            ],
            [
                "Tekla Teresa \u0141ubie\u0144ska",
                "country of citizenship",
                "Polish"
            ]
        ],
        "schema_definition": {
            "place of birth": "The subject entity was born in the location specified by the object entity.",
            "date of death": "The subject entity died on the date specified by the object entity.",
            "nationality": "The subject entity is associated with or holds the nationality specified by the object entity.",
            "date of birth": "The subject entity was born on the date specified by the object entity.",
            "place of death": "The subject entity died in the location specified by the object entity.",
            "occupation": "The subject entity is engaged in or holds the occupation specified by the object entity."
        },
        "canonicalization_candidates": "[{}, {}, {}, {}, {}, {}, {}, {'country of citizenship': np.float32(0.8912878), 'country of origin': np.float32(0.8527403), 'ethnic group': np.float32(0.8494179), 'relative': np.float32(0.83814013), 'allegiance': np.float32(0.8378295)}]",
        "schema_canonicalizaiton": [
            [
                "Tekla Teresa \u0141ubie\u0144ska",
                "date of birth",
                "6 June 1767"
            ],
            [
                "Tekla Teresa \u0141ubie\u0144ska",
                "place of birth",
                "Warsaw"
            ],
            [
                "Tekla Teresa \u0141ubie\u0144ska",
                "date of death",
                "15 August 1810"
            ],
            [
                "Tekla Teresa \u0141ubie\u0144ska",
                "place of death",
                "Krak\u00f3w"
            ],
            [
                "Tekla Teresa \u0141ubie\u0144ska",
                "occupation",
                "playwright"
            ],
            [
                "Tekla Teresa \u0141ubie\u0144ska",
                "occupation",
                "poet"
            ],
            [
                "Tekla Teresa \u0141ubie\u0144ska",
                "occupation",
                "translator"
            ],
            [
                "Tekla Teresa \u0141ubie\u0144ska",
                "country of citizenship",
                "Polish"
            ]
        ]
    }
]