[
    {
        "index": 0,
        "input_text": "Spodnje Ho\u010de () is a settlement in and the administrative centre of the Municipality of Ho\u010de\u2013Slivnica in northeastern Slovenia.\n",
        "entity_hint": [
            "Municipality of Ho\u010de\u2013Slivnica",
            "Slovenia",
            "Spodnje Ho\u010de",
            "northeastern Slovenia",
            "Ho\u010de\u2013Slivnica"
        ],
        "relation_hint": "1. country: The subject entity is located in the country specified by the object entity.\nFor example, ['Municipality of Ho\u010de\u2013Slivnica', 'country', 'Slovenia'] can be extracted from \"Spodnje Ho\u010de () is a settlement in and the administrative centre of the Municipality of Ho\u010de\u2013Slivnica in northeastern Slovenia.\n\"\n2. located in the administrative territorial entity: The subject entity is located in the administrative territorial entity specified by the object entity.\nFor example, ['Tiverton', 'located in the administrative territorial entity', 'Devon'] can be extracted from \"Peter Sainthill (8 July 1593 \u2001E12 August 1648) of Bradninch in Devon, England, was twice elected a Member of Parliament for Tiverton in Devon, in the Short Parliament 1640 and in the Long Parliament in November 1640.\n\"\n3. contains settlement: The subject entity contains the settlement specified by the object entity.\n4. located in present-day administrative territorial entity: The subject entity is located in the present-day administrative territorial entity specified by the object entity.\n5. contains administrative territorial entity: The subject entity contains the administrative territorial entity specified by the object entity.\n6. location: The subject entity is located in the place specified by the object entity.\nFor example, ['Stanford University', 'location', 'California'] can be extracted from \"Los Trancos Creek (meaning \"barriers\" or \"cattle guards\" from the Spanish \"Las Trancas\") is a creek that flows northerly from Monte Bello Ridge on the northeast slope of the Santa Cruz Mountains to its confluence with San Francisquito Creek at Stanford University in California, United States.\n\"\n7. residence: The subject entity resides in the location specified by the object entity.\nFor example, ['Peter Sainthill', 'residence', 'Bradninch'] can be extracted from \"Peter Sainthill (8 July 1593 \u2001E12 August 1648) of Bradninch in Devon, England, was twice elected a Member of Parliament for Tiverton in Devon, in the Short Parliament 1640 and in the Long Parliament in November 1640.\n\"\n8. capital: The subject entity is the capital city of the country specified by the object entity.\n9. basin country: The subject entity is part of the basin country specified by the object entity.\n10. capital of: The object entity is the capital city of the subject entity.\n",
        "oie": [
            [
                "Spodnje Ho\u010de",
                "located in the administrative territorial entity",
                "Municipality of Ho\u010de\u2013Slivnica"
            ],
            [
                "Municipality of Ho\u010de\u2013Slivnica",
                "country",
                "Slovenia"
            ]
        ],
        "schema_definition": {
            "located in the administrative territorial entity": "The subject entity is situated within the geographical or administrative boundaries of the specified territorial entity.",
            "country": "The subject entity is located within the borders of the specified country."
        },
        "canonicalization_candidates": "[{}, {}]",
        "schema_canonicalizaiton": [
            [
                "Spodnje Ho\u010de",
                "located in the administrative territorial entity",
                "Municipality of Ho\u010de\u2013Slivnica"
            ],
            [
                "Municipality of Ho\u010de\u2013Slivnica",
                "country",
                "Slovenia"
            ]
        ]
    },
    {
        "index": 1,
        "input_text": "Herbert Blankenhorn (15 December 1904 in M\u00fclhausen\u00a0\u2001E10 August 1991 in Badenweiler) was a German diplomat.\n",
        "entity_hint": [],
        "relation_hint": "1. date of birth: The subject entity was born on the date specified by the object entity.\nFor example, ['Tekla Teresa \u0141ubie\u0144ska', 'date of birth', '6 June 1767'] can be extracted from \"Tekla Teresa \u0141ubie\u0144ska (born 6 June 1767 in Warsaw, died 15 August 1810 in Krak\u00f3w) \u2001Ewas a Polish playwright, poet and translator.\n\"\n2. date of death: The subject entity died on the date specified by the object entity.\nFor example, ['Herbert Blankenhorn', 'date of death', '10 August 1991'] can be extracted from \"Herbert Blankenhorn (15 December 1904 in M\u00fclhausen\u00a0\u2001E10 August 1991 in Badenweiler) was a German diplomat.\n\"\n3. occupation: The subject entity works in the occupation specified by the object entity.\nFor example, ['Tekla Teresa \u0141ubie\u0144ska', 'occupation', 'playwright'] can be extracted from \"Tekla Teresa \u0141ubie\u0144ska (born 6 June 1767 in Warsaw, died 15 August 1810 in Krak\u00f3w) \u2001Ewas a Polish playwright, poet and translator.\n\"\n4. place of birth: The subject entity was born in the location specified by the object entity.\nFor example, ['Josef Sch\u00e4ffer', 'place of birth', 'Moravia'] can be extracted from \"Josef Sch\u00e4ffer (born July 2, 1891 in Moravia) was an Austrian track and field athlete who competed in the 1912 Summer Olympics.\n\"\n5. place of death: The subject entity died in the location specified by the object entity.\nFor example, ['Tekla Teresa \u0141ubie\u0144ska', 'place of death', 'Krak\u00f3w'] can be extracted from \"Tekla Teresa \u0141ubie\u0144ska (born 6 June 1767 in Warsaw, died 15 August 1810 in Krak\u00f3w) \u2001Ewas a Polish playwright, poet and translator.\n\"\n6. diplomatic relation: The subject entity has a diplomatic relationship with the entity specified by the object entity.\n7. country of origin: The subject entity originates from the country specified by the object entity.\n8. country of citizenship: The subject entity holds the citizenship of the country specified by the object entity.\nFor example, ['Saleem Safi', 'country of citizenship', 'Pakistan'] can be extracted from \"Saleem Safi (Urdu, ) is a Pakistani journalist, columnist, defence analyst and current affairs TV talk show anchorperson.\n\"\n9. historical region: The subject entity is associated with or belongs to the historical region specified by the object entity.\n10. head of state: The subject entity is the head of state of the entity specified by the object entity.\n11. father: The subject entity is the father of the object entity.\n",
        "oie": [
            [
                "Herbert Blankenhorn",
                "date of birth",
                "15 December 1904"
            ],
            [
                "Herbert Blankenhorn",
                "date of death",
                "10 August 1991"
            ],
            [
                "Herbert Blankenhorn",
                "occupation",
                "diplomat"
            ]
        ],
        "schema_definition": {
            "date of birth": "The subject entity was born on the date specified by the object entity.",
            "date of death": "The subject entity died on the date specified by the object entity.",
            "occupation": "The subject entity's professional role or job is specified by the object entity."
        },
        "canonicalization_candidates": "[{}, {}, {}]",
        "schema_canonicalizaiton": [
            [
                "Herbert Blankenhorn",
                "date of birth",
                "15 December 1904"
            ],
            [
                "Herbert Blankenhorn",
                "date of death",
                "10 August 1991"
            ],
            [
                "Herbert Blankenhorn",
                "occupation",
                "diplomat"
            ]
        ]
    },
    {
        "index": 2,
        "input_text": "Operation Dragon Strike was a NATO counter-insurgent mission in Kandahar province, Afghanistan, against Taliban forces, which started on September 15, 2010.\n",
        "entity_hint": [
            "Afghanistan",
            "Kandahar province",
            "NATO counter-insurgent mission",
            "Operation Dragon Strike",
            "September 15, 2010",
            "Taliban forces",
            "NATO",
            "Kandahar",
            "Taliban"
        ],
        "relation_hint": "1. country: The subject entity is located in the country specified by the object entity.\nFor example, ['Municipality of Ho\u010de\u2013Slivnica', 'country', 'Slovenia'] can be extracted from \"Spodnje Ho\u010de () is a settlement in and the administrative centre of the Municipality of Ho\u010de\u2013Slivnica in northeastern Slovenia.\n\"\n2. location: The subject entity is located in the place specified by the object entity.\nFor example, ['Stanford University', 'location', 'California'] can be extracted from \"Los Trancos Creek (meaning \"barriers\" or \"cattle guards\" from the Spanish \"Las Trancas\") is a creek that flows northerly from Monte Bello Ridge on the northeast slope of the Santa Cruz Mountains to its confluence with San Francisquito Creek at Stanford University in California, United States.\n\"\n3. point in time: The object entity specifies a specific point in time the subject entity took place in.\nFor example, ['Operation Dragon Strike', 'point in time', 'September 15, 2010'] can be extracted from \"Operation Dragon Strike was a NATO counter-insurgent mission in Kandahar province, Afghanistan, against Taliban forces, which started on September 15, 2010.\n\"\n4. subclass of: The subject entity is a subclass or specific type of the object entity.\nFor example, ['Operation Dragon Strike', 'subclass of', 'NATO counter-insurgent mission'] can be extracted from \"Operation Dragon Strike was a NATO counter-insurgent mission in Kandahar province, Afghanistan, against Taliban forces, which started on September 15, 2010.\n\"\n5. target: The subject entity is the target of the action or event specified by the object entity.\nFor example, ['Taliban forces', 'target', 'Operation Dragon Strike'] can be extracted from \"Operation Dragon Strike was a NATO counter-insurgent mission in Kandahar province, Afghanistan, against Taliban forces, which started on September 15, 2010.\n\"\n6. conflict: The subject entity was involved in the conflict specified by the object entity.\n7. military branch: The subject entity belongs to the military branch specified by the object entity.\n8. start time: The subject entity began at the time specified by the object entity.\nFor example, ['Long Parliament', 'start time', 'November 1640'] can be extracted from \"Peter Sainthill (8 July 1593 \u2001E12 August 1648) of Bradninch in Devon, England, was twice elected a Member of Parliament for Tiverton in Devon, in the Short Parliament 1640 and in the Long Parliament in November 1640.\n\"\n9. country of origin: The subject entity originates from the country specified by the object entity.\n10. basin country: The subject entity is part of the basin country specified by the object entity.\n11. relative: The subject entity is related to the entity specified by the object entity.\n12. subsidiary: The subject entity is a subsidiary or part of the entity specified by the object entity.\n",
        "oie": [
            [
                "Operation Dragon Strike",
                "location",
                "Kandahar"
            ],
            [
                "Operation Dragon Strike",
                "country",
                "Afghanistan"
            ],
            [
                "Operation Dragon Strike",
                "point in time",
                "September 15, 2010"
            ],
            [
                "Operation Dragon Strike",
                "subclass of",
                "NATO counter-insurgent mission"
            ],
            [
                "Taliban forces",
                "target",
                "Operation Dragon Strike"
            ]
        ],
        "schema_definition": {
            "subclass of": "The subject entity is a specific example or type within the broader category specified by the object entity.",
            "target": "The subject entity is the intended recipient or focus of the action or effort of the object entity.",
            "location": "The subject entity is situated in or associated with the place specified by the object entity.",
            "point in time": "The subject entity occurs or is relevant at the specific time specified by the object entity.",
            "country": "The subject entity is located within or associated with the country specified by the object entity."
        },
        "canonicalization_candidates": "[{}, {}, {}, {}, {}]",
        "schema_canonicalizaiton": [
            [
                "Operation Dragon Strike",
                "location",
                "Kandahar"
            ],
            [
                "Operation Dragon Strike",
                "country",
                "Afghanistan"
            ],
            [
                "Operation Dragon Strike",
                "point in time",
                "September 15, 2010"
            ],
            [
                "Operation Dragon Strike",
                "subclass of",
                "NATO counter-insurgent mission"
            ],
            [
                "Taliban forces",
                "target",
                "Operation Dragon Strike"
            ]
        ]
    },
    {
        "index": 3,
        "input_text": "Saleem Safi (Urdu, ) is a Pakistani journalist, columnist, defence analyst and current affairs TV talk show anchorperson.\n",
        "entity_hint": [
            "Pakistan",
            "Saleem Safi",
            "TV talk show anchorperson",
            "Urdu",
            "columnist",
            "defence analyst",
            "journalist"
        ],
        "relation_hint": "1. country of citizenship: The subject entity holds the citizenship of the country specified by the object entity.\nFor example, ['Saleem Safi', 'country of citizenship', 'Pakistan'] can be extracted from \"Saleem Safi (Urdu, ) is a Pakistani journalist, columnist, defence analyst and current affairs TV talk show anchorperson.\n\"\n2. language used: The subject entity uses the language specified by the object entity.\nFor example, ['Saleem Safi', 'language used', 'Urdu'] can be extracted from \"Saleem Safi (Urdu, ) is a Pakistani journalist, columnist, defence analyst and current affairs TV talk show anchorperson.\n\"\n3. occupation: The subject entity works in the occupation specified by the object entity.\nFor example, ['Tekla Teresa \u0141ubie\u0144ska', 'occupation', 'playwright'] can be extracted from \"Tekla Teresa \u0141ubie\u0144ska (born 6 June 1767 in Warsaw, died 15 August 1810 in Krak\u00f3w) \u2001Ewas a Polish playwright, poet and translator.\n\"\n4. presenter: The subject entity was presented or hosted by the person specified by the object entity.\n5. relative: The subject entity is related to the entity specified by the object entity.\n6. field of this occupation: The subject entity works in the field specified by the object entity.\n7. is a list of: The subject entity is a member of the list or category specified by the object entity.\n8. sibling: The subject entity is a sibling of the entity specified by the object entity.\n9. subclass of: The subject entity is a subclass or specific type of the object entity.\nFor example, ['Operation Dragon Strike', 'subclass of', 'NATO counter-insurgent mission'] can be extracted from \"Operation Dragon Strike was a NATO counter-insurgent mission in Kandahar province, Afghanistan, against Taliban forces, which started on September 15, 2010.\n\"\n10. employer: The subject entity is employed by the entity specified by the object entity.\n11. member of: The subject entity is a member of the group or organization specified by the object entity.\n12. speaker: The subject entity delivered a speech or address as the person specified by the object entity.\n",
        "oie": [
            [
                "Saleem Safi",
                "country of citizenship",
                "Pakistan"
            ],
            [
                "Saleem Safi",
                "language used",
                "Urdu"
            ],
            [
                "Saleem Safi",
                "occupation",
                "journalist"
            ],
            [
                "Saleem Safi",
                "occupation",
                "columnist"
            ],
            [
                "Saleem Safi",
                "occupation",
                "defence analyst"
            ],
            [
                "Saleem Safi",
                "occupation",
                "TV talk show anchorperson"
            ]
        ],
        "schema_definition": {
            "occupation": "The subject entity is engaged in the activity or profession specified by the object entity.",
            "country of citizenship": "The subject entity holds citizenship or legal nationality of the country specified by the object entity.",
            "language used": "The subject entity primarily communicates or produces content in the language specified by the object entity."
        },
        "canonicalization_candidates": "[{}, {}, {}, {}, {}, {}]",
        "schema_canonicalizaiton": [
            [
                "Saleem Safi",
                "country of citizenship",
                "Pakistan"
            ],
            [
                "Saleem Safi",
                "language used",
                "Urdu"
            ],
            [
                "Saleem Safi",
                "occupation",
                "journalist"
            ],
            [
                "Saleem Safi",
                "occupation",
                "columnist"
            ],
            [
                "Saleem Safi",
                "occupation",
                "defence analyst"
            ],
            [
                "Saleem Safi",
                "occupation",
                "TV talk show anchorperson"
            ]
        ]
    },
    {
        "index": 4,
        "input_text": "Los Trancos Creek (meaning \"barriers\" or \"cattle guards\" from the Spanish \"Las Trancas\") is a creek that flows northerly from Monte Bello Ridge on the northeast slope of the Santa Cruz Mountains to its confluence with San Francisquito Creek at Stanford University in California, United States.\n",
        "entity_hint": [
            "California",
            "Los Trancos Creek",
            "Monte Bello Ridge",
            "San Francisquito Creek",
            "Santa Cruz Mountains",
            "Stanford University",
            "United States",
            "northeast"
        ],
        "relation_hint": "1. located on terrain feature: The subject entity is located on the terrain feature specified by the object entity.\nFor example, ['Monte Bello Ridge', 'located on terrain feature', 'northeast'] can be extracted from \"Los Trancos Creek (meaning \"barriers\" or \"cattle guards\" from the Spanish \"Las Trancas\") is a creek that flows northerly from Monte Bello Ridge on the northeast slope of the Santa Cruz Mountains to its confluence with San Francisquito Creek at Stanford University in California, United States.\n\"\n2. location: The subject entity is located in the place specified by the object entity.\nFor example, ['California', 'location', 'United States'] can be extracted from \"Los Trancos Creek (meaning \"barriers\" or \"cattle guards\" from the Spanish \"Las Trancas\") is a creek that flows northerly from Monte Bello Ridge on the northeast slope of the Santa Cruz Mountains to its confluence with San Francisquito Creek at Stanford University in California, United States.\n\"\n3. mouth of the watercourse: The subject entity is the point where the watercourse specified by the object entity flows into.\nFor example, ['Los Trancos Creek', 'mouth of the watercourse', 'San Francisquito Creek'] can be extracted from \"Los Trancos Creek (meaning \"barriers\" or \"cattle guards\" from the Spanish \"Las Trancas\") is a creek that flows northerly from Monte Bello Ridge on the northeast slope of the Santa Cruz Mountains to its confluence with San Francisquito Creek at Stanford University in California, United States.\n\"\n4. start point: The subject entity started from the location specified by the object entity.\nFor example, ['Los Trancos Creek', 'start point', 'Monte Bello Ridge'] can be extracted from \"Los Trancos Creek (meaning \"barriers\" or \"cattle guards\" from the Spanish \"Las Trancas\") is a creek that flows northerly from Monte Bello Ridge on the northeast slope of the Santa Cruz Mountains to its confluence with San Francisquito Creek at Stanford University in California, United States.\n\"\n5. mountain range: The subject entity belongs to the mountain range specified by the object entity.\n6. tributary: The subject entity is a tributary that flows into the watercourse specified by the object entity.\n7. located in or next to body of water: The subject entity is situated in or near the body of water specified by the object entity.\n8. located in the administrative territorial entity: The subject entity is located in the administrative territorial entity specified by the object entity.\nFor example, ['Spodnje Ho\u010de', 'located in the administrative territorial entity', 'Municipality of Ho\u010de\u2013Slivnica'] can be extracted from \"Spodnje Ho\u010de () is a settlement in and the administrative centre of the Municipality of Ho\u010de\u2013Slivnica in northeastern Slovenia.\n\"\n9. country: The subject entity is located in the country specified by the object entity.\nFor example, ['Municipality of Ho\u010de\u2013Slivnica', 'country', 'Slovenia'] can be extracted from \"Spodnje Ho\u010de () is a settlement in and the administrative centre of the Municipality of Ho\u010de\u2013Slivnica in northeastern Slovenia.\n\"\n10. located in present-day administrative territorial entity: The subject entity is located in the present-day administrative territorial entity specified by the object entity.\n11. lakes on river: The subject entity is a collection of lakes that are located on the river specified by the object entity.\n",
        "oie": [
            [
                "Los Trancos Creek",
                "start point",
                "Monte Bello Ridge"
            ],
            [
                "Los Trancos Creek",
                "mouth of the watercourse",
                "San Francisquito Creek"
            ],
            [
                "Monte Bello Ridge",
                "located on terrain feature",
                "northeast"
            ],
            [
                "Monte Bello Ridge",
                "located in the administrative territorial entity",
                "California"
            ],
            [
                "San Francisquito Creek",
                "located in the administrative territorial entity",
                "California"
            ],
            [
                "Los Trancos Creek",
                "located in the administrative territorial entity",
                "California"
            ],
            [
                "Los Trancos Creek",
                "location",
                "United States"
            ],
            [
                "California",
                "location",
                "United States"
            ]
        ],
        "schema_definition": {
            "mouth of the watercourse": "The subject entity is the endpoint or confluence point where the watercourse flows into another body of water.",
            "location": "The subject entity is situated in or occupies the place specified by the object entity.",
            "located in the administrative territorial entity": "The subject entity is within or part of the administrative region specified by the object entity.",
            "located on terrain feature": "The subject entity is situated on or associated with the terrain feature specified by the object entity.",
            "start point": "The subject entity marks the origin or beginning location of the watercourse."
        },
        "canonicalization_candidates": "[{}, {}, {}, {}, {}, {}, {}, {}]",
        "schema_canonicalizaiton": [
            [
                "Los Trancos Creek",
                "start point",
                "Monte Bello Ridge"
            ],
            [
                "Los Trancos Creek",
                "mouth of the watercourse",
                "San Francisquito Creek"
            ],
            [
                "Monte Bello Ridge",
                "located on terrain feature",
                "northeast"
            ],
            [
                "Monte Bello Ridge",
                "located in the administrative territorial entity",
                "California"
            ],
            [
                "San Francisquito Creek",
                "located in the administrative territorial entity",
                "California"
            ],
            [
                "Los Trancos Creek",
                "located in the administrative territorial entity",
                "California"
            ],
            [
                "Los Trancos Creek",
                "location",
                "United States"
            ],
            [
                "California",
                "location",
                "United States"
            ]
        ]
    },
    {
        "index": 5,
        "input_text": "Peter Sainthill (8 July 1593 \u2001E12 August 1648) of Bradninch in Devon, England, was twice elected a Member of Parliament for Tiverton in Devon, in the Short Parliament 1640 and in the Long Parliament in November 1640.\n",
        "entity_hint": [
            "12 August 1648",
            "8 July 1593",
            "Bradninch",
            "Devon",
            "England",
            "Long Parliament",
            "Member of Parliament",
            "November 1640",
            "Peter Sainthill",
            "Short Parliament 1640",
            "Tiverton",
            "Short Parliament",
            "1640"
        ],
        "relation_hint": "1. candidacy in election: The subject entity ran as a candidate in the election specified by the object entity.\nFor example, ['Peter Sainthill', 'candidacy in election', 'Short Parliament 1640'] can be extracted from \"Peter Sainthill (8 July 1593 \u2001E12 August 1648) of Bradninch in Devon, England, was twice elected a Member of Parliament for Tiverton in Devon, in the Short Parliament 1640 and in the Long Parliament in November 1640.\n\"\n2. date of birth: The subject entity was born on the date specified by the object entity.\nFor example, ['Herbert Blankenhorn', 'date of birth', '15 December 1904'] can be extracted from \"Herbert Blankenhorn (15 December 1904 in M\u00fclhausen\u00a0\u2001E10 August 1991 in Badenweiler) was a German diplomat.\n\"\n3. date of death: The subject entity died on the date specified by the object entity.\nFor example, ['Tekla Teresa \u0141ubie\u0144ska', 'date of death', '15 August 1810'] can be extracted from \"Tekla Teresa \u0141ubie\u0144ska (born 6 June 1767 in Warsaw, died 15 August 1810 in Krak\u00f3w) \u2001Ewas a Polish playwright, poet and translator.\n\"\n4. located in the administrative territorial entity: The subject entity is located in the administrative territorial entity specified by the object entity.\nFor example, ['Spodnje Ho\u010de', 'located in the administrative territorial entity', 'Municipality of Ho\u010de\u2013Slivnica'] can be extracted from \"Spodnje Ho\u010de () is a settlement in and the administrative centre of the Municipality of Ho\u010de\u2013Slivnica in northeastern Slovenia.\n\"\n5. position held: The subject entity held the position specified by the object entity.\nFor example, ['Peter Sainthill', 'position held', 'Member of Parliament'] can be extracted from \"Peter Sainthill (8 July 1593 \u2001E12 August 1648) of Bradninch in Devon, England, was twice elected a Member of Parliament for Tiverton in Devon, in the Short Parliament 1640 and in the Long Parliament in November 1640.\n\"\n6. residence: The subject entity resides in the location specified by the object entity.\nFor example, ['Peter Sainthill', 'residence', 'Bradninch'] can be extracted from \"Peter Sainthill (8 July 1593 \u2001E12 August 1648) of Bradninch in Devon, England, was twice elected a Member of Parliament for Tiverton in Devon, in the Short Parliament 1640 and in the Long Parliament in November 1640.\n\"\n7. start time: The subject entity began at the time specified by the object entity.\nFor example, ['Long Parliament', 'start time', 'November 1640'] can be extracted from \"Peter Sainthill (8 July 1593 \u2001E12 August 1648) of Bradninch in Devon, England, was twice elected a Member of Parliament for Tiverton in Devon, in the Short Parliament 1640 and in the Long Parliament in November 1640.\n\"\n8. member of political party: The subject entity is a member of the political party specified by the object entity.\n9. sibling: The subject entity is a sibling of the entity specified by the object entity.\n10. family: The subject entity belongs to the family specified by the object entity.\n11. head of government: The subject entity is the leader or head of government of the entity specified by the object entity.\n12. historical region: The subject entity is associated with or belongs to the historical region specified by the object entity.\n13. officeholder: The subject entity is the officeholder of the position specified by the object entity.\n14. legislative body: The subject entity is the legislative body of the jurisdiction specified by the object entity.\n15. head of state: The subject entity is the head of state of the entity specified by the object entity.\n16. relative: The subject entity is related to the entity specified by the object entity.\n17. is a list of: The subject entity is a member of the list or category specified by the object entity.\n",
        "oie": [
            [
                "Peter Sainthill",
                "date of birth",
                "8 July 1593"
            ],
            [
                "Peter Sainthill",
                "date of death",
                "12 August 1648"
            ],
            [
                "Peter Sainthill",
                "residence",
                "Bradninch"
            ],
            [
                "Peter Sainthill",
                "position held",
                "Member of Parliament"
            ],
            [
                "Peter Sainthill",
                "candidacy in election",
                "Short Parliament 1640"
            ],
            [
                "Peter Sainthill",
                "candidacy in election",
                "Long Parliament"
            ],
            [
                "Peter Sainthill",
                "start time",
                "November 1640"
            ]
        ],
        "schema_definition": {
            "candidacy in election": "The subject entity was a candidate in the election or electoral event specified by the object entity.",
            "position held": "The subject entity occupied or was assigned the role or office specified by the object entity.",
            "residence": "The subject entity lived or was based in the location specified by the object entity.",
            "start time": "The time or date when the subject entity began holding a particular role, position, or activity.",
            "date of birth": "The subject entity was born on the date specified by the object entity.",
            "date of death": "The subject entity died on the date specified by the object entity."
        },
        "canonicalization_candidates": "[{}, {}, {}, {}, {}, {}, {}]",
        "schema_canonicalizaiton": [
            [
                "Peter Sainthill",
                "date of birth",
                "8 July 1593"
            ],
            [
                "Peter Sainthill",
                "date of death",
                "12 August 1648"
            ],
            [
                "Peter Sainthill",
                "residence",
                "Bradninch"
            ],
            [
                "Peter Sainthill",
                "position held",
                "Member of Parliament"
            ],
            [
                "Peter Sainthill",
                "candidacy in election",
                "Short Parliament 1640"
            ],
            [
                "Peter Sainthill",
                "candidacy in election",
                "Long Parliament"
            ],
            [
                "Peter Sainthill",
                "start time",
                "November 1640"
            ]
        ]
    },
    {
        "index": 6,
        "input_text": "Romany Love is a 1931 British musical film directed by Fred Paul and starring Esmond Knight, Florence McHugh and Roy Travers.\n",
        "entity_hint": [
            "Britain",
            "Esmond Knight",
            "Florence McHugh",
            "Fred Paul",
            "Romany Love",
            "Roy Travers",
            "musical film",
            "British"
        ],
        "relation_hint": "1. cast member: The subject entity includes the person specified by the object entity as a member of its cast.\nFor example, ['Florence McHugh', 'cast member', 'Romany Love'] can be extracted from \"Romany Love is a 1931 British musical film directed by Fred Paul and starring Esmond Knight, Florence McHugh and Roy Travers.\n\"\n2. country: The subject entity is located in the country specified by the object entity.\nFor example, ['Romany Love', 'country', 'Britain'] can be extracted from \"Romany Love is a 1931 British musical film directed by Fred Paul and starring Esmond Knight, Florence McHugh and Roy Travers.\n\"\n3. director: The subject entity was directed by the person or entity specified by the object entity.\nFor example, ['Romany Love', 'director', 'Fred Paul'] can be extracted from \"Romany Love is a 1931 British musical film directed by Fred Paul and starring Esmond Knight, Florence McHugh and Roy Travers.\n\"\n4. genre: The subject entity belongs to the genre specified by the object entity.\nFor example, ['Romany Love', 'genre', 'musical film'] can be extracted from \"Romany Love is a 1931 British musical film directed by Fred Paul and starring Esmond Knight, Florence McHugh and Roy Travers.\n\"\n5. composer: The subject entity's music was composed by the person specified by the object entity.\n6. voice type: The subject entity has the voice type specified by the object entity.\n7. present in work: The subject entity is present or featured in the work specified by the object entity.\n8. performer: The subject entity was performed or created by the person or entity specified by the object entity.\n9. relative: The subject entity is related to the entity specified by the object entity.\n10. depicts: The subject entity portrays or represents the entity specified by the object entity.\n11. characters: The object entity includes the subject entity as one of its characters.\n",
        "oie": [
            [
                "Romany Love",
                "country",
                "Britain"
            ],
            [
                "Romany Love",
                "director",
                "Fred Paul"
            ],
            [
                "Romany Love",
                "genre",
                "musical film"
            ],
            [
                "Esmond Knight",
                "cast member",
                "Romany Love"
            ],
            [
                "Florence McHugh",
                "cast member",
                "Romany Love"
            ],
            [
                "Roy Travers",
                "cast member",
                "Romany Love"
            ]
        ],
        "schema_definition": {
            "country": "The subject entity is located in or associated with the country specified by the object entity.",
            "cast member": "The subject entity is an individual who is part of the cast of the subject entity.",
            "director": "The subject entity was directed by the person or entity specified by the object entity.",
            "genre": "The subject entity belongs to the genre specified by the object entity."
        },
        "canonicalization_candidates": "[{}, {}, {}, {}, {}, {}]",
        "schema_canonicalizaiton": [
            [
                "Romany Love",
                "country",
                "Britain"
            ],
            [
                "Romany Love",
                "director",
                "Fred Paul"
            ],
            [
                "Romany Love",
                "genre",
                "musical film"
            ],
            [
                "Esmond Knight",
                "cast member",
                "Romany Love"
            ],
            [
                "Florence McHugh",
                "cast member",
                "Romany Love"
            ],
            [
                "Roy Travers",
                "cast member",
                "Romany Love"
            ]
        ]
    },
    {
        "index": 7,
        "input_text": "Monopoly Star Wars is the 1997 Monopoly franchise Star Wars video game based on the board game and set in the Star Wars fictional universe.\n",
        "entity_hint": [
            "1997",
            "Monopoly Star Wars",
            "Star Wars",
            "Star Wars fictional universe",
            "board game",
            "video game"
        ],
        "relation_hint": "1. based on: The subject entity is based on or inspired by the entity specified by the object entity.\nFor example, ['Monopoly Star Wars', 'based on', 'board game'] can be extracted from \"Monopoly Star Wars is the 1997 Monopoly franchise Star Wars video game based on the board game and set in the Star Wars fictional universe.\n\"\n2. instance of: The subject entity is an instance or example of the type specified by the object entity.\nFor example, ['Monopoly Star Wars', 'instance of', 'video game'] can be extracted from \"Monopoly Star Wars is the 1997 Monopoly franchise Star Wars video game based on the board game and set in the Star Wars fictional universe.\n\"\n3. narrative location: The subject entity's storyline or setting is based in the location specified by the object entity.\nFor example, ['Monopoly Star Wars', 'narrative location', 'Star Wars fictional universe'] can be extracted from \"Monopoly Star Wars is the 1997 Monopoly franchise Star Wars video game based on the board game and set in the Star Wars fictional universe.\n\"\n4. part of: The subject entity is a part of or belongs to the object entity.\nFor example, ['Star Wars fictional universe', 'part of', 'Star Wars'] can be extracted from \"Monopoly Star Wars is the 1997 Monopoly franchise Star Wars video game based on the board game and set in the Star Wars fictional universe.\n\"\n5. publication date: The subject entity was published or released on the date specified by the object entity.\nFor example, ['Monopoly Star Wars', 'publication date', '1997'] can be extracted from \"Monopoly Star Wars is the 1997 Monopoly franchise Star Wars video game based on the board game and set in the Star Wars fictional universe.\n\"\n6. media franchise: The subject entity is a part of the media franchise specified by the object entity.\n7. game mechanics: The subject entity features the game mechanics specified by the object entity.\n8. part of the series: The subject entity is a part of the series specified by the object entity.\n9. game mode: The subject entity features the game mode specified by the object entity.\n10. characters: The object entity includes the subject entity as one of its characters.\n11. owned by: The subject entity is owned by the entity specified by the object entity.\n12. production company: The subject entity was produced or created by the company specified by the object entity.\n13. present in work: The subject entity is present or featured in the work specified by the object entity.\n14. relative: The subject entity is related to the entity specified by the object entity.\n",
        "oie": [
            [
                "Monopoly Star Wars",
                "instance of",
                "video game"
            ],
            [
                "Monopoly Star Wars",
                "based on",
                "board game"
            ],
            [
                "Monopoly Star Wars",
                "narrative location",
                "Star Wars fictional universe"
            ],
            [
                "Monopoly Star Wars",
                "publication date",
                "1997"
            ],
            [
                "Star Wars fictional universe",
                "part of",
                "Star Wars"
            ]
        ],
        "schema_definition": {
            "instance of": "The subject entity is an example or specific instance of the type specified by the object entity.",
            "based on": "The subject entity is derived from or uses the content, concept, or structure of the object entity.",
            "publication date": "The subject entity was published or released on the date specified by the object entity.",
            "narrative location": "The subject entity is set in or takes place within the location specified by the object entity.",
            "part of": "The subject entity is a component or member of the larger entity specified by the object entity."
        },
        "canonicalization_candidates": "[{}, {}, {}, {}, {}]",
        "schema_canonicalizaiton": [
            [
                "Monopoly Star Wars",
                "instance of",
                "video game"
            ],
            [
                "Monopoly Star Wars",
                "based on",
                "board game"
            ],
            [
                "Monopoly Star Wars",
                "narrative location",
                "Star Wars fictional universe"
            ],
            [
                "Monopoly Star Wars",
                "publication date",
                "1997"
            ],
            [
                "Star Wars fictional universe",
                "part of",
                "Star Wars"
            ]
        ]
    },
    {
        "index": 8,
        "input_text": "Josef Sch\u00e4ffer (born July 2, 1891 in Moravia) was an Austrian track and field athlete who competed in the 1912 Summer Olympics.\n",
        "entity_hint": [
            "1912 Summer Olympics",
            "Austrian",
            "Josef Sch\u00e4ffer",
            "July 2, 1891",
            "Moravia",
            "track and field athlete",
            "Austria"
        ],
        "relation_hint": "1. country of citizenship: The subject entity holds the citizenship of the country specified by the object entity.\nFor example, ['Saleem Safi', 'country of citizenship', 'Pakistan'] can be extracted from \"Saleem Safi (Urdu, ) is a Pakistani journalist, columnist, defence analyst and current affairs TV talk show anchorperson.\n\"\n2. date of birth: The subject entity was born on the date specified by the object entity.\nFor example, ['Peter Sainthill', 'date of birth', '8 July 1593'] can be extracted from \"Peter Sainthill (8 July 1593 \u2001E12 August 1648) of Bradninch in Devon, England, was twice elected a Member of Parliament for Tiverton in Devon, in the Short Parliament 1640 and in the Long Parliament in November 1640.\n\"\n3. occupation: The subject entity works in the occupation specified by the object entity.\nFor example, ['Saleem Safi', 'occupation', 'TV talk show anchorperson'] can be extracted from \"Saleem Safi (Urdu, ) is a Pakistani journalist, columnist, defence analyst and current affairs TV talk show anchorperson.\n\"\n4. participant in: The subject entity took part in the event specified by the object entity.\nFor example, ['Josef Sch\u00e4ffer', 'participant in', '1912 Summer Olympics'] can be extracted from \"Josef Sch\u00e4ffer (born July 2, 1891 in Moravia) was an Austrian track and field athlete who competed in the 1912 Summer Olympics.\n\"\n5. place of birth: The subject entity was born in the location specified by the object entity.\nFor example, ['Herbert Blankenhorn', 'place of birth', 'M\u00fclhausen'] can be extracted from \"Herbert Blankenhorn (15 December 1904 in M\u00fclhausen\u00a0\u2001E10 August 1991 in Badenweiler) was a German diplomat.\n\"\n6. sports discipline competed in: The subject entity competes in the sports discipline specified by the object entity.\n7. sport: The subject entity is associated with the sport specified by the object entity.\n8. country for sport: The subject entity represents the country specified by the object entity in the sport mentioned.\n9. country of origin: The subject entity originates from the country specified by the object entity.\n10. member of sports team: The subject entity is a member of the sports team specified by the object entity.\n11. father: The subject entity is the father of the object entity.\n12. competition class: The subject entity competes in the competition class specified by the object entity.\n",
        "oie": [
            [
                "Josef Sch\u00e4ffer",
                "date of birth",
                "July 2, 1891"
            ],
            [
                "Josef Sch\u00e4ffer",
                "place of birth",
                "Moravia"
            ],
            [
                "Josef Sch\u00e4ffer",
                "participant in",
                "1912 Summer Olympics"
            ],
            [
                "Josef Sch\u00e4ffer",
                "country of citizenship",
                "Austria"
            ],
            [
                "Josef Sch\u00e4ffer",
                "occupation",
                "track and field athlete"
            ]
        ],
        "schema_definition": {
            "place of birth": "The subject entity was born in the location specified by the object entity.",
            "country of citizenship": "The subject entity holds citizenship or nationality in the country specified by the object entity.",
            "date of birth": "The subject entity was born on the date specified by the object entity.",
            "occupation": "The subject entity's professional role or job is specified by the object entity.",
            "participant in": "The subject entity took part in the event or activity specified by the object entity."
        },
        "canonicalization_candidates": "[{}, {}, {}, {}, {}]",
        "schema_canonicalizaiton": [
            [
                "Josef Sch\u00e4ffer",
                "date of birth",
                "July 2, 1891"
            ],
            [
                "Josef Sch\u00e4ffer",
                "place of birth",
                "Moravia"
            ],
            [
                "Josef Sch\u00e4ffer",
                "participant in",
                "1912 Summer Olympics"
            ],
            [
                "Josef Sch\u00e4ffer",
                "country of citizenship",
                "Austria"
            ],
            [
                "Josef Sch\u00e4ffer",
                "occupation",
                "track and field athlete"
            ]
        ]
    },
    {
        "index": 9,
        "input_text": "Tekla Teresa \u0141ubie\u0144ska (born 6 June 1767 in Warsaw, died 15 August 1810 in Krak\u00f3w) \u2001Ewas a Polish playwright, poet and translator.\n",
        "entity_hint": [
            "15 August 1810",
            "6 June 1767",
            "Krak\u00f3w",
            "Tekla Teresa \u0141ubie\u0144ska",
            "Warsaw",
            "playwright",
            "poet",
            "translator",
            "Polish"
        ],
        "relation_hint": "1. date of birth: The subject entity was born on the date specified by the object entity.\nFor example, ['Tekla Teresa \u0141ubie\u0144ska', 'date of birth', '6 June 1767'] can be extracted from \"Tekla Teresa \u0141ubie\u0144ska (born 6 June 1767 in Warsaw, died 15 August 1810 in Krak\u00f3w) \u2001Ewas a Polish playwright, poet and translator.\n\"\n2. date of death: The subject entity died on the date specified by the object entity.\nFor example, ['Herbert Blankenhorn', 'date of death', '10 August 1991'] can be extracted from \"Herbert Blankenhorn (15 December 1904 in M\u00fclhausen\u00a0\u2001E10 August 1991 in Badenweiler) was a German diplomat.\n\"\n3. occupation: The subject entity works in the occupation specified by the object entity.\nFor example, ['Saleem Safi', 'occupation', 'defence analyst'] can be extracted from \"Saleem Safi (Urdu, ) is a Pakistani journalist, columnist, defence analyst and current affairs TV talk show anchorperson.\n\"\n4. place of birth: The subject entity was born in the location specified by the object entity.\nFor example, ['Josef Sch\u00e4ffer', 'place of birth', 'Moravia'] can be extracted from \"Josef Sch\u00e4ffer (born July 2, 1891 in Moravia) was an Austrian track and field athlete who competed in the 1912 Summer Olympics.\n\"\n5. place of death: The subject entity died in the location specified by the object entity.\nFor example, ['Tekla Teresa \u0141ubie\u0144ska', 'place of death', 'Krak\u00f3w'] can be extracted from \"Tekla Teresa \u0141ubie\u0144ska (born 6 June 1767 in Warsaw, died 15 August 1810 in Krak\u00f3w) \u2001Ewas a Polish playwright, poet and translator.\n\"\n6. librettist: The subject entity's book or libretto was written by the person or entity specified by the object entity.\n7. screenwriter: The subject entity was written by the person or entity specified by the object entity.\n8. author: The subject entity was authored or created by the person specified by the object entity.\n9. lyrics by: The subject entity's lyrics were written by the person specified by the object entity.\n10. writing language: The subject entity was written in the language specified by the object entity.\n11. historical region: The subject entity is associated with or belongs to the historical region specified by the object entity.\n",
        "oie": [
            [
                "Tekla Teresa \u0141ubie\u0144ska",
                "date of birth",
                "6 June 1767"
            ],
            [
                "Tekla Teresa \u0141ubie\u0144ska",
                "place of birth",
                "Warsaw"
            ],
            [
                "Tekla Teresa \u0141ubie\u0144ska",
                "date of death",
                "15 August 1810"
            ],
            [
                "Tekla Teresa \u0141ubie\u0144ska",
                "place of death",
                "Krak\u00f3w"
            ],
            [
                "Tekla Teresa \u0141ubie\u0144ska",
                "occupation",
                "playwright"
            ],
            [
                "Tekla Teresa \u0141ubie\u0144ska",
                "occupation",
                "poet"
            ],
            [
                "Tekla Teresa \u0141ubie\u0144ska",
                "occupation",
                "translator"
            ],
            [
                "Tekla Teresa \u0141ubie\u0144ska",
                "nationality",
                "Polish"
            ]
        ],
        "schema_definition": {
            "place of birth": "The subject entity was born in the location specified by the object entity.",
            "date of birth": "The subject entity was born on the date specified by the object entity.",
            "date of death": "The subject entity died on the date specified by the object entity.",
            "place of death": "The subject entity died in the location specified by the object entity.",
            "occupation": "The subject entity is engaged in the activity or profession specified by the object entity.",
            "nationality": "The subject entity belongs to the nationality specified by the object entity."
        },
        "canonicalization_candidates": "[{}, {}, {}, {}, {}, {}, {}, {'country of citizenship': np.float32(0.87994474), 'ethnic group': np.float32(0.86236703), 'country of origin': np.float32(0.8614728), 'member of': np.float32(0.8375963), 'family': np.float32(0.82962525)}]",
        "schema_canonicalizaiton": [
            [
                "Tekla Teresa \u0141ubie\u0144ska",
                "date of birth",
                "6 June 1767"
            ],
            [
                "Tekla Teresa \u0141ubie\u0144ska",
                "place of birth",
                "Warsaw"
            ],
            [
                "Tekla Teresa \u0141ubie\u0144ska",
                "date of death",
                "15 August 1810"
            ],
            [
                "Tekla Teresa \u0141ubie\u0144ska",
                "place of death",
                "Krak\u00f3w"
            ],
            [
                "Tekla Teresa \u0141ubie\u0144ska",
                "occupation",
                "playwright"
            ],
            [
                "Tekla Teresa \u0141ubie\u0144ska",
                "occupation",
                "poet"
            ],
            [
                "Tekla Teresa \u0141ubie\u0144ska",
                "occupation",
                "translator"
            ],
            [
                "Tekla Teresa \u0141ubie\u0144ska",
                "country of citizenship",
                "Polish"
            ]
        ]
    }
]